{
  "titulo": "PARTIDA INTERCALADA EM LADDER (CLP)",
  "dsl": "ladder/1",
  "layout": {
    "trilhos": {"L1": 14, "L2": 20, "L3": 26, "N": 282, "PE": 291, "x0": 25, "x1": 160},
    "fontes": [
      {"id": "X1", "classe": "3007", "rotulo": "-X",
       "pinos": {"L1": "L1", "L2": "L2", "L3": "L3", "N": "N", "PE": "PE"}}
    ],
    "potencia": [
      {"id": "m1", "fases": ["L1", "L2", "L3"], "neutro": "N", "pe": "PE",
       "colunas": [
         ["Q1", "6009", "-Q1"],
         ["F1", "6007", "-RT1"],
         ["KM1p", "2001", "-KM1"],
         ["M1", "1000", "-M1"]
       ]},
      {"id": "m2", "fases": ["L1", "L2", "L3"], "neutro": "N", "pe": "PE",
       "colunas": [
         ["Q2", "6009", "-Q2"],
         ["F2", "6007", "-RT2"],
         ["KM2p", "2001", "-KM2"],
         ["M2", "1000", "-M2"]
       ]}
    ],
    "clp": {
      "id": "CLP1", "classe": "10206", "rotulo": "-CLP",
      "alimentacao": {"fonte": {"id": "X2", "classe": "3011", "rotulo": "-X2"}},
      "entradas": [
        {"operando": "I0.0", "dispositivo": ["S0", "8001", "-S0"]},
        {"operando": "I0.1", "dispositivo": ["S1", "8000", "-S1"]},
        {"operando": "I0.2", "dispositivo": ["RT1", "8017", "-RT1"]},
        {"operando": "I0.3", "dispositivo": ["RT2", "8017", "-RT2"]}
      ],
      "saidas": [
        {"operando": "Q0.0", "carga": ["KM1", "9000", "-KM1"]},
        {"operando": "Q0.1", "carga": ["KM2", "9000", "-KM2"]}
      ]
    },
    "ladder": {
      "fonte": {"id": "XL", "classe": "3008", "rotulo": "+L"},
      "trilho_direito": "aberto",
      "rungs": [
        {"id": "r1", "comentario": "M1 parte quando M0.0=0; selo Q0.0; bloqueado por Q0.1",
         "logica": {"serie": [
           ["NA", "I0.2"],
           ["NA", "I0.3"],
           ["NA", "I0.0"],
           {"paralelo": [
             {"serie": [["NA", "I0.1"], ["NF", "M0.0"]]},
             ["NA", "Q0.0"]
           ]},
           ["NF", "Q0.1"]
         ]},
         "saida": ["OUT", "Q0.0"]},
        {"id": "r2", "comentario": "M2 parte quando M0.0=1; selo Q0.1; bloqueado por Q0.0",
         "logica": {"serie": [
           ["NA", "I0.2"],
           ["NA", "I0.3"],
           ["NA", "I0.0"],
           {"paralelo": [
             {"serie": [["NA", "I0.1"], ["NA", "M0.0"]]},
             ["NA", "Q0.1"]
           ]},
           ["NF", "Q0.0"]
         ]},
         "saida": ["OUT", "Q0.1"]},
        {"id": "r3", "comentario": "M1 rodou: a proxima partida e do M2",
         "logica": ["NA", "Q0.0"],
         "saida": ["SET", "M0.0"]},
        {"id": "r4", "comentario": "M2 rodou: a proxima partida e do M1",
         "logica": ["NA", "Q0.1"],
         "saida": ["RST", "M0.0"]}
      ]
    }
  },
  "testes": [
    {"nome": "repouso desligado", "entradas": {}, "status": "OK", "esperado": [],
     "esperado_bits": {"M0.0": 0}},
    {"nome": "1a partida (M0.0=0) liga M1 e arma M0.0", "entradas": {"S1": true}, "status": "OK",
     "esperado": ["KM1"], "esperado_bits": {"Q0.0": 1, "Q0.1": 0, "M0.0": 1}},
    {"nome": "partida com M0.0=1 liga M2 e desarma M0.0", "entradas": {"S1": true}, "inicial": ["M0.0"],
     "status": "OK", "esperado": ["KM2"], "esperado_bits": {"Q0.0": 0, "Q0.1": 1, "M0.0": 0}},
    {"nome": "selo mantem KM1", "entradas": {}, "inicial": ["Q0.0", "M0.0"], "status": "OK", "esperado": ["KM1"]},
    {"nome": "selo mantem KM2", "entradas": {}, "inicial": ["Q0.1"], "status": "OK", "esperado": ["KM2"]},
    {"nome": "S0 desliga e M0.0 fica memorizado", "entradas": {"S0": true}, "inicial": ["Q0.0", "M0.0"],
     "status": "OK", "esperado": [], "esperado_bits": {"M0.0": 1}},
    {"nome": "RT1 derruba KM1", "entradas": {"RT1": true}, "inicial": ["Q0.0", "M0.0"], "status": "OK", "esperado": []},
    {"nome": "RT2 derruba KM2", "entradas": {"RT2": true}, "inicial": ["Q0.1"], "status": "OK", "esperado": []},
    {"nome": "RT2 aberto bloqueia a partida do M1", "entradas": {"RT2": true, "S1": true}, "status": "OK", "esperado": []},
    {"nome": "sequencia alternada M1, M2, M1 com termico", "status": "OK",
     "sequencia": [
       {"nome": "repouso", "entradas": {}, "esperado": [], "esperado_bits": {"M0.0": 0}},
       {"nome": "liga: M1", "entradas": {"S1": true}, "esperado": ["KM1"], "esperado_bits": {"M0.0": 1}},
       {"nome": "solta: selo", "entradas": {}, "esperado": ["KM1"]},
       {"nome": "desliga", "entradas": {"S0": true}, "esperado": [], "esperado_bits": {"M0.0": 1}},
       {"nome": "solta", "entradas": {}, "esperado": []},
       {"nome": "liga: M2", "entradas": {"S1": true}, "esperado": ["KM2"], "esperado_bits": {"M0.0": 0}},
       {"nome": "solta: selo", "entradas": {}, "esperado": ["KM2"]},
       {"nome": "desliga", "entradas": {"S0": true}, "esperado": []},
       {"nome": "liga: M1 de novo", "entradas": {"S1": true}, "esperado": ["KM1"]},
       {"nome": "termico do M1", "entradas": {"RT1": true}, "esperado": []},
       {"nome": "termico + liga: bloqueado", "entradas": {"RT1": true, "S1": true}, "esperado": []},
       {"nome": "rearmado sem liga: nao religa", "entradas": {}, "esperado": []}
     ]}
  ]
}
