{
  "titulo": "CONTADOR CTU COM RESET (10063)",
  "dsl": "ladder/1",
  "layout": {
    "trilhos": {"L1": 14, "L2": 20, "L3": 26, "N": 282, "PE": 291, "x0": 25, "x1": 160},
    "fontes": [
      {"id": "X1", "classe": "3007", "rotulo": "-X",
       "pinos": {"L1": "L1", "L2": "L2", "L3": "L3", "N": "N", "PE": "PE"}}
    ],
    "potencia": [
      {"id": "m1", "fases": ["L1", "L2", "L3"], "neutro": "N", "pe": "PE",
       "colunas": [
         ["Q1", "6009", "-Q1"],
         ["F1", "6007", "-RT1"],
         ["KM1p", "2001", "-KM1"],
         ["M1", "1000", "-M1"]
       ]}
    ],
    "clp": {
      "id": "CLP1", "classe": "10206", "rotulo": "-CLP",
      "alimentacao": {"fonte": {"id": "X2", "classe": "3011", "rotulo": "-X2"}},
      "entradas": [
        {"operando": "I0.1", "dispositivo": ["S1", "8000", "-S1"]},
        {"operando": "I0.2", "dispositivo": ["S2", "8000", "-S2"]}
      ],
      "saidas": [
        {"operando": "Q0.0", "carga": ["KM1", "9000", "-KM1"]},
        {"operando": "Q0.1", "carga": ["H1", "9008", "-H1"]}
      ]
    },
    "ladder": {
      "fonte": {"id": "XL", "classe": "3008", "rotulo": "+L"},
      "trilho_direito": "aberto",
      "rungs": [
        {"id": "r1", "comentario": "conta pulsos de S1; S2 zera (reset por bit no pino R)",
         "logica": ["NA", "I0.1"],
         "saida": ["CTU", "C1", {"preset": 3, "reset": "I0.2"}]},
        {"id": "r2", "comentario": "KM1 liga quando a contagem chega a 3",
         "logica": ["NA", "C1"],
         "saida": ["OUT", "Q0.0"]},
        {"id": "r3", "comentario": "H1 acompanha KM1",
         "logica": ["NA", "Q0.0"],
         "saida": ["OUT", "Q0.1"]}
      ]
    }
  },
  "testes": [
    {"nome": "repouso zerado", "entradas": {}, "status": "OK",
     "esperado": [], "esperado_lampadas": [],
     "esperado_bits": {"I0.1": 0, "I0.2": 0, "C1": 0, "C1.Q": 0, "Q0.0": 0}},
    {"nome": "S1 mantido conta 1 so (sem borda nao conta)", "entradas": {"S1": true}, "status": "OK",
     "esperado": [], "esperado_lampadas": [],
     "esperado_bits": {"I0.1": 1, "C1": 0}},
    {"nome": "3 pulsos ligam; S2 zera e reconta", "status": "OK",
     "sequencia": [
       {"nome": "pulso 1 (conta 1)", "entradas": {"S1": true}, "ticks": 2,
        "esperado": [], "esperado_lampadas": [],
        "esperado_bits": {"C1": 0}},
       {"nome": "intervalo", "entradas": {}, "ticks": 2,
        "esperado": [], "esperado_lampadas": []},
       {"nome": "pulso 2 (conta 2)", "entradas": {"S1": true}, "ticks": 2,
        "esperado": [], "esperado_lampadas": [],
        "esperado_bits": {"C1": 0}},
       {"nome": "intervalo", "entradas": {}, "ticks": 2,
        "esperado": [], "esperado_lampadas": []},
       {"nome": "pulso 3 (conta 3): C1 liga no mesmo tick", "entradas": {"S1": true}, "ticks": 2,
        "esperado": [], "esperado_lampadas": [],
        "esperado_bits": {"C1": 1}},
       {"nome": "assenta: KM1 e H1 ligados", "entradas": {},
        "esperado": ["KM1"], "esperado_lampadas": ["H1"],
        "esperado_bits": {"C1": 1, "Q0.0": 1}},
       {"nome": "S2 zera a contagem", "entradas": {"S2": true}, "ticks": 2,
        "esperado": ["KM1"], "esperado_lampadas": ["H1"],
        "esperado_bits": {"C1": 0}},
       {"nome": "saida cai no tick seguinte", "entradas": {}, "ticks": 1,
        "esperado": ["KM1"], "esperado_lampadas": ["H1"],
        "esperado_bits": {"C1": 0, "Q0.0": 0}},
       {"nome": "assenta desligado e zerado", "entradas": {},
        "esperado": [], "esperado_lampadas": [],
        "esperado_bits": {"C1": 0, "C1.Q": 0, "Q0.0": 0, "Q0.1": 0}}
     ]}
  ]
}
